{
  "api_version": "kdlc.dev/release-evaluation-report/v1alpha1",
  "release_status": "not-ready",
  "run_hash": "sha256:7d7b2b1efe2ee3aecbaac44f932888b1859166f596a7459359509ed75ea3cdcc",
  "summary": {"total": 9, "passed": 9, "failed": 0, "security_failures": 0, "structural_gate": "passed"},
  "statistical_suite": {"status": "pending", "release_blocking": true},
  "pending_release_evidence": [
    "statistical-quality-report",
    "final-version-changelog-artifact-agreement",
    "release-tag-and-package",
    "current-public-state-verification",
    "external-protection-settings",
    "independent-release-verification"
  ]
}
